{
  "attempt": 1,
  "body_sha256": "89652deba326387f31ca18b95ca09cba0ced9765dd3f6251d002b52bc6279ef3",
  "bytes": 2705,
  "checkpoint": "continuity-checkpoint-v1",
  "execution_id": "exec-003-006-runtime-adoption-001",
  "max_bytes": 16384,
  "no_op": false,
  "packet_id": "003-006-runtime-adoption-implementer-green-005",
  "prev_checkpoint_sha256": null,
  "references": [
    {
      "path": "docs/specs/003-006-runtime-adoption/spec.md",
      "sha256": "dc485e80aa86b545c75c86f71a3fa590321c1ca6a66221e1115c69b75a7d7cb7"
    },
    {
      "path": "docs/specs/003-006-runtime-adoption/plan.md",
      "sha256": "fca4be822bd4463377799559be5f49b9fcc7ec22c7f978619b1da5e4e85cd5b4"
    },
    {
      "path": "docs/specs/003-006-runtime-adoption/dispatch-ledger.md",
      "sha256": "45bb7d0f1cccb98514a634f245e7da20ce63ebc15b418c57524f612f3fa79eb3"
    },
    {
      "path": "docs/specs/003-006-runtime-adoption/adoption-ledger.md",
      "sha256": "d6a2de786cc2fb2597380db56eaee9659ac1ec9db3161979f462c64ada678adf"
    },
    {
      "path": "docs/specs/003-006-runtime-adoption/debt.md",
      "sha256": "db03412b6ef07847a343ce233669fb3a40bc98e8ce8809661d14dc3bfc662690"
    },
    {
      "path": "docs/specs/003-006-runtime-adoption/t4-ru1-decision.md",
      "sha256": "f01d8bf69537f76b249bee187746e2c8dc99c0089cdc49c2a8c5aa1921894655"
    }
  ],
  "schema_version": 1,
  "seq": 1
}
